Project Name,Description,Start Date,Allocated Budget (USD)
Central road renovation,Redesign and rehabilitation of the main streets in downtown Willow Creek,2023-09-01,750000
Public lighting modernization (LED),Replacement of faulty streetlights and installation of LED lighting,2023-10-15,300000
Innovative Cultural Center creation,Construction of a cultural center to promote local arts,2024-01-20,1200000
Green spaces improvement,Redevelopment of city parks and gardens,2023-11-10,450000
City broadband infrastructure development,Installation of high-speed connectivity in public buildings,2024-03-05,200000
Elementary school renovation,Modernization and expansion of the town's elementary school facilities,2023-08-20,650000
City Sports Center creation,Construction of a multifunctional sports complex,2023-07-15,950000
Market Square redevelopment,Reconfiguration of the public space to support local commerce,2023-10-05,500000
Urban surveillance system,Installation of cameras to strengthen public safety,2023-12-01,400000
Community garden creation,Development of a shared green space to encourage urban gardening,2024-04-10,150000
Bike lanes development,Creation of a secure bike lane network across the town,2023-09-15,350000
Public transit service modernization,Upgrade and renewal of city transit vehicles,2024-02-20,800000
Installation of electric vehicle charging stations,Deployment of charging stations for electric vehicles,2024-05-05,250000
Digital Innovation Center creation,Development of an incubator for startups and technology innovation,2024-03-10,1100000
Advanced selective sorting system,Optimization of waste management through an intelligent sorting system,2023-11-20,300000
